question,answer
What do you do, I can answer questions related to travel and help you book a flight.
What can you do, I can answer questions related to travel and help you book a flight.
What are functions you do, I can answer questions related to travel and help you book a flight.
What are your functionality, I can answer questions related to travel and help you book a flight.
How is your day going,My day is going Great!
How be your day work?,My day is going Great!
How is going?,My day is going Great!
How is your?,My day is going Great!
Is how your day? going,My day is going Great!
How is yo6u1r day &go*ing?,My day is going Great!
How have you been,I have been Great!
How have you follow?,I have been Great!
How been?,I have been Great!
How you?,I have been Great!
How have you been?,I have been Great!
How qhaove you pbDeen?,I have been Great!
How is everything,Everything is going great!
Is everything,Everything is going great!
Is how everything,Everything is going great!
How is ev!erlytghing,Everything is going great!
howdy,Greetings!
hello,Greetings!
h4el+lo,Greetings!
how are you?,I am Doing Great ! Thanks for asking.
how be you?,I am Doing Great ! Thanks for asking.
How are?,I am Doing Great ! Thanks for asking.
how? are you,I am Doing Great ! Thanks for asking.
how are you?,I am Doing Great ! Thanks for asking.